{"pacing_plan_id":"pace_fixture","version_number":1,"total_duration_seconds":15,"episodes":[{"conflict_intensity":0.7,"emotional_intensity":0.6,"information_reveal":0.5,"hook_strength":0.8}],"beats":[{"beat_key":"beat.fixture","episode_number":1,"beat_ordinal":1,"conflict_intensity":0.7,"emotional_intensity":0.6,"information_reveal":0.5,"hook_strength":0.8,"reversal_strength":0.3,"dialogue_ratio":0.3,"action_ratio":0.5,"narration_ratio":0.2,"estimated_duration_seconds":15}],"issues":[]}
